python/tvm/tensor_graph/testing/cutlass/test.csv
Problem,Provider,OperationKind,Operation,Disposition,Status,gemm_kind,m,n,k,A,B,C,alpha,beta,split_k_slices,batch_count,op_class,accum,cta_m,cta_n,cta_k,stages,warps_m,warps_n,warps_k,inst_m,inst_n,inst_k,min_cc,max_cc,Bytes,Flops,Runtime,GB/s,GFLOPs
1,CUTLASS,gemm,cutlass_simt_sgemm_128x128_8x2_nn_align1,passed,success,universal,4352,4096,4096,f32:column,f32:column,f32:column,1,0,1,1,simt,f32,128,128,8,2,4,2,1,1,1,1,50,1024,209715200,146064539648,9.0534,21.5734,16133.7
1,CUTLASS,gemm,cutlass_simt_sgemm_128x128_8x2_nt_align1,passed,success,universal,4352,4096,4096,f32:column,f32:row,f32:column,1,0,1,1,simt,f32,128,128,8,2,4,2,1,1,1,1,50,1024,209715200,146064539648,8.74572,22.3324,16701.3
1,CUTLASS,gemm,cutlass_simt_sgemm_128x128_8x2_tn_align1,passed,success,universal,4352,4096,4096,f32:row,f32:column,f32:column,1,0,1,1,simt,f32,128,128,8,2,4,2,1,1,1,1,50,1024,209715200,146064539648,8.80785,22.1748,16583.4
1,CUTLASS,gemm,cutlass_simt_sgemm_128x128_8x2_tt_align1,passed,success,universal,4352,4096,4096,f32:row,f32:row,f32:column,1,0,1,1,simt,f32,128,128,8,2,4,2,1,1,1,1,50,1024,209715200,146064539648,8.77395,22.2605,16647.5
1,CUTLASS,gemm,cutlass_simt_sgemm_256x128_8x5_nn_align1,passed,success,universal,4352,4096,4096,f32:column,f32:column,f32:column,1,0,1,1,simt,f32,256,128,8,5,4,2,1,1,1,1,80,1024,209715200,146064539648,9.61092,20.3219,15197.8
1,CUTLASS,gemm,cutlass_simt_sgemm_256x128_8x5_nt_align1,passed,success,universal,4352,4096,4096,f32:column,f32:row,f32:column,1,0,1,1,simt,f32,256,128,8,5,4,2,1,1,1,1,80,1024,209715200,146064539648,9.44849,20.6713,15459
1,CUTLASS,gemm,cutlass_simt_sgemm_256x128_8x5_tn_align1,passed,success,universal,4352,4096,4096,f32:row,f32:column,f32:column,1,0,1,1,simt,f32,256,128,8,5,4,2,1,1,1,1,80,1024,209715200,146064539648,9.68547,20.1655,15080.8
1,CUTLASS,gemm,cutlass_simt_sgemm_256x128_8x5_tt_align1,passed,success,universal,4352,4096,4096,f32:row,f32:row,f32:column,1,0,1,1,simt,f32,256,128,8,5,4,2,1,1,1,1,80,1024,209715200,146064539648,9.60511,20.3342,15207